{
  "id": "audience",
  "title": "Audience",
  "type": "foundation",
  "domains": [
    "foundations"
  ],
  "subdomains": [
    "communication_and_meaning"
  ],
  "summary": "Audience is a foundational idea for making, carrying, interpreting, or contesting meaning.",
  "prerequisites": [
    "language",
    "information",
    "relation"
  ],
  "unlocks": [],
  "related": [
    "channel",
    "context_of_communication",
    "information",
    "language",
    "relation"
  ],
  "aliases": [],
  "tags": [
    "communication_and_meaning",
    "foundation",
    "information",
    "language",
    "relation"
  ],
  "sources": {
    "wikipedia": "",
    "britannica": "",
    "openstax": "",
    "stanford_encyclopedia": ""
  },
  "status": "stub"
}
