{
  "id": "function",
  "title": "Function",
  "type": "foundation",
  "domains": [
    "foundations"
  ],
  "subdomains": [
    "models_and_reasoning"
  ],
  "summary": "Function is a foundational idea for forming, testing, or communicating an understanding of something.",
  "prerequisites": [
    "knowledge",
    "model",
    "language"
  ],
  "unlocks": [],
  "related": [
    "algorithm",
    "knowledge",
    "language",
    "model",
    "variable"
  ],
  "aliases": [],
  "tags": [
    "foundation",
    "knowledge",
    "language",
    "model",
    "models_and_reasoning"
  ],
  "sources": {
    "wikipedia": "",
    "britannica": "",
    "openstax": "",
    "stanford_encyclopedia": ""
  },
  "status": "stub"
}
