{
  "id": "inference",
  "title": "Inference",
  "type": "foundation",
  "domains": [
    "foundations"
  ],
  "subdomains": [
    "models_and_reasoning"
  ],
  "summary": "Inference is a foundational idea for forming, testing, or communicating an understanding of something.",
  "prerequisites": [
    "knowledge",
    "model",
    "language"
  ],
  "unlocks": [],
  "related": [
    "assumption",
    "deduction",
    "knowledge",
    "language",
    "model"
  ],
  "aliases": [],
  "tags": [
    "foundation",
    "knowledge",
    "language",
    "model",
    "models_and_reasoning"
  ],
  "sources": {
    "wikipedia": "",
    "britannica": "",
    "openstax": "",
    "stanford_encyclopedia": ""
  },
  "status": "stub"
}
