{
  "id": "mass",
  "title": "Mass",
  "type": "foundation",
  "domains": [
    "foundations"
  ],
  "subdomains": [
    "matter_and_energy"
  ],
  "summary": "Mass is a foundational idea for describing physical things, forces, and transformations.",
  "prerequisites": [
    "matter",
    "energy",
    "measurement"
  ],
  "unlocks": [],
  "related": [
    "energy",
    "force",
    "gradient",
    "matter",
    "measurement"
  ],
  "aliases": [],
  "tags": [
    "energy",
    "foundation",
    "matter",
    "matter_and_energy",
    "measurement"
  ],
  "sources": {
    "wikipedia": "",
    "britannica": "",
    "openstax": "",
    "stanford_encyclopedia": ""
  },
  "status": "stub"
}
