{
  "id": "language",
  "title": "Language",
  "type": "foundation",
  "domains": [
    "foundations"
  ],
  "subdomains": [
    "core_primitives"
  ],
  "summary": "Language is a foundational connector for describing what exists, changes, relates, or becomes understandable.",
  "prerequisites": [],
  "unlocks": [
    "abduction",
    "abstraction",
    "algorithm",
    "analogy",
    "argument",
    "assumption",
    "audience",
    "category",
    "causation",
    "channel",
    "classification",
    "code",
    "community",
    "computation",
    "conflict",
    "context_of_communication",
    "convention",
    "cooperation",
    "correlation",
    "culture",
    "deduction",
    "definition",
    "dialogue",
    "discourse",
    "economy",
    "exchange",
    "explanation",
    "function",
    "governance",
    "grammar",
    "group",
    "ideology",
    "induction",
    "inference",
    "institution",
    "interpretation",
    "labor",
    "law",
    "legitimacy",
    "literacy",
    "meaning",
    "medium",
    "message",
    "metaphor",
    "narrative",
    "norm",
    "paradox",
    "persuasion",
    "pragmatics",
    "prediction",
    "probability",
    "proof",
    "property",
    "representation",
    "ritual",
    "role",
    "semantics",
    "sign",
    "society",
    "speech",
    "status",
    "symbol",
    "syntax",
    "technology",
    "translation",
    "uncertainty",
    "variable",
    "writing"
  ],
  "related": [
    "change",
    "value"
  ],
  "aliases": [],
  "tags": [
    "core_primitives",
    "foundation"
  ],
  "sources": {
    "wikipedia": "",
    "britannica": "",
    "openstax": "",
    "stanford_encyclopedia": ""
  },
  "status": "stub"
}
