{
  "id": "globalization",
  "title": "Globalization",
  "type": "foundation",
  "domains": [
    "foundations"
  ],
  "subdomains": [
    "history_and_time"
  ],
  "summary": "Globalization is a foundational idea for locating change, continuity, and human action in time.",
  "prerequisites": [
    "time",
    "cause",
    "evidence"
  ],
  "unlocks": [],
  "related": [
    "cause",
    "event",
    "evidence",
    "time",
    "urbanization"
  ],
  "aliases": [],
  "tags": [
    "cause",
    "evidence",
    "foundation",
    "history_and_time",
    "time"
  ],
  "sources": {
    "wikipedia": "",
    "britannica": "",
    "openstax": "",
    "stanford_encyclopedia": ""
  },
  "status": "stub"
}
