{
  "id": "justice",
  "title": "Justice",
  "type": "foundation",
  "domains": [
    "foundations"
  ],
  "subdomains": [
    "values_and_action"
  ],
  "summary": "Justice is a foundational idea for deciding what matters and what should be done.",
  "prerequisites": [
    "value",
    "power",
    "knowledge"
  ],
  "unlocks": [],
  "related": [
    "freedom",
    "knowledge",
    "morality",
    "power",
    "value"
  ],
  "aliases": [],
  "tags": [
    "foundation",
    "knowledge",
    "power",
    "value",
    "values_and_action"
  ],
  "sources": {
    "wikipedia": "",
    "britannica": "",
    "openstax": "",
    "stanford_encyclopedia": ""
  },
  "status": "stub"
}
