{
  "id": "energy",
  "title": "Energy",
  "type": "foundation",
  "domains": [
    "foundations"
  ],
  "subdomains": [
    "core_primitives"
  ],
  "summary": "Energy is a foundational connector for describing what exists, changes, relates, or becomes understandable.",
  "prerequisites": [],
  "unlocks": [
    "atom",
    "charge",
    "conservation",
    "density",
    "dimension",
    "entropy",
    "field",
    "force",
    "frequency",
    "gradient",
    "heat",
    "magnitude",
    "mass",
    "molecule",
    "momentum",
    "motion",
    "particle",
    "pressure",
    "radiation",
    "symmetry",
    "temperature",
    "transformation",
    "wave"
  ],
  "related": [
    "matter",
    "state"
  ],
  "aliases": [],
  "tags": [
    "core_primitives",
    "foundation"
  ],
  "sources": {
    "wikipedia": "",
    "britannica": "",
    "openstax": "",
    "stanford_encyclopedia": ""
  },
  "status": "stub"
}
