{
  "id": "agency",
  "title": "Agency",
  "type": "foundation",
  "domains": [
    "foundations"
  ],
  "subdomains": [
    "life_and_mind"
  ],
  "summary": "Agency is a foundational idea for understanding living systems, minds, and adaptive behavior.",
  "prerequisites": [
    "system",
    "information",
    "matter"
  ],
  "unlocks": [],
  "related": [
    "consciousness",
    "information",
    "intelligence",
    "matter",
    "system"
  ],
  "aliases": [],
  "tags": [
    "foundation",
    "information",
    "life_and_mind",
    "matter",
    "system"
  ],
  "sources": {
    "wikipedia": "",
    "britannica": "",
    "openstax": "",
    "stanford_encyclopedia": ""
  },
  "status": "stub"
}
