{
  "id": "ratio",
  "title": "Ratio",
  "type": "foundation",
  "domains": [
    "foundations"
  ],
  "subdomains": [
    "quantity_and_form"
  ],
  "summary": "Ratio is a foundational idea for reasoning about amount, form, order, and formal relationships.",
  "prerequisites": [
    "quantity",
    "pattern",
    "structure"
  ],
  "unlocks": [],
  "related": [
    "operation",
    "pattern",
    "proportion",
    "quantity",
    "structure"
  ],
  "aliases": [],
  "tags": [
    "foundation",
    "pattern",
    "quantity",
    "quantity_and_form",
    "structure"
  ],
  "sources": {
    "wikipedia": "",
    "britannica": "",
    "openstax": "",
    "stanford_encyclopedia": ""
  },
  "status": "stub"
}
