{
  "id": "measurement",
  "title": "Measurement",
  "type": "foundation",
  "domains": [
    "foundations"
  ],
  "subdomains": [
    "core_primitives"
  ],
  "summary": "Measurement is a foundational connector for describing what exists, changes, relates, or becomes understandable.",
  "prerequisites": [],
  "unlocks": [
    "accuracy",
    "atom",
    "authority",
    "bias",
    "charge",
    "citation",
    "conservation",
    "data",
    "density",
    "dimension",
    "entropy",
    "error",
    "experiment",
    "expertise",
    "falsifiability",
    "field",
    "force",
    "frequency",
    "gradient",
    "heat",
    "hypothesis",
    "inference_to_best_explanation",
    "magnitude",
    "mass",
    "molecule",
    "momentum",
    "motion",
    "observation",
    "particle",
    "peer_review",
    "population",
    "precision",
    "pressure",
    "radiation",
    "reliability",
    "replication",
    "sample",
    "skepticism",
    "source",
    "symmetry",
    "temperature",
    "test",
    "transformation",
    "validity",
    "wave"
  ],
  "related": [
    "evidence",
    "feedback"
  ],
  "aliases": [
    "measure"
  ],
  "tags": [
    "core_primitives",
    "foundation"
  ],
  "sources": {
    "wikipedia": "",
    "britannica": "",
    "openstax": "",
    "stanford_encyclopedia": ""
  },
  "status": "stub"
}
