{
  "id": "role",
  "title": "Role",
  "type": "foundation",
  "domains": [
    "foundations"
  ],
  "subdomains": [
    "society_and_culture"
  ],
  "summary": "Role is a foundational idea for understanding social life, shared meaning, and organized action.",
  "prerequisites": [
    "language",
    "value",
    "power"
  ],
  "unlocks": [],
  "related": [
    "institution",
    "language",
    "norm",
    "power",
    "value"
  ],
  "aliases": [],
  "tags": [
    "foundation",
    "language",
    "power",
    "society_and_culture",
    "value"
  ],
  "sources": {
    "wikipedia": "",
    "britannica": "",
    "openstax": "",
    "stanford_encyclopedia": ""
  },
  "status": "stub"
}
